{
  "schema_version": "standalone_removal_plan.v1",
  "plan_id": "plan-full-removal-canonical",
  "claim_boundary": "Binds one pure removal plan against one exact manifest identity (#11470). The plan never itself executes; execution belongs to the removal-executor successors under #11527 and requires exact currentness at run time.",
  "bound_subject": {
    "install_root_absolute_path": "/home/alice/.local/share/perllsp",
    "install_root_digest_sha256": "4444444444444444444444444444444444444444444444444444444444444444",
    "manifest_sha256": "4bcbd2ef71e9d461c7ed64211bb0b1fe038fc74a3aad8706a599e23eddbf497e"
  },
  "lifecycle_policy": "full_removal_selected",
  "running_process_policy": "abort_on_running",
  "path_cleanup": {
    "mode": "exact_owned_entries_only",
    "entries": [
      ".perllsp-path-marker",
      ".perllsp-profile-marker",
      "registry/perllsp-uninstall.marker"
    ]
  },
  "actions": [
    {
      "relative_path": "candidates/v0.18.0-x86_64-unknown-linux-gnu",
      "action": "remove_exact",
      "order_index": 0,
      "verified_identity_sha256": "d0a1000000000000000000000000000000000000000000000000000000000000",
      "reason": "owned immutable_candidate_dir with verified current identity"
    },
    {
      "relative_path": "candidates/v0.17.2-x86_64-unknown-linux-gnu",
      "action": "remove_exact",
      "order_index": 1,
      "verified_identity_sha256": "d0a3000000000000000000000000000000000000000000000000000000000000",
      "reason": "owned immutable_candidate_dir with verified current identity"
    },
    {
      "relative_path": "current",
      "action": "remove_exact",
      "order_index": 2,
      "verified_identity_sha256": "d0a4000000000000000000000000000000000000000000000000000000000000",
      "reason": "owned selection_marker with verified current identity"
    },
    {
      "relative_path": "receipts/current.json",
      "action": "remove_exact",
      "order_index": 3,
      "verified_identity_sha256": "d0a5000000000000000000000000000000000000000000000000000000000000",
      "reason": "owned installation_receipt with verified current identity"
    },
    {
      "relative_path": "receipts/previous-v0.17.2.json",
      "action": "remove_exact",
      "order_index": 4,
      "verified_identity_sha256": "d0a6000000000000000000000000000000000000000000000000000000000000",
      "reason": "owned installation_receipt with verified current identity"
    },
    {
      "relative_path": "attempts/attempt-2026-08-20T10-00-00Z.json",
      "action": "remove_exact",
      "order_index": 5,
      "verified_identity_sha256": "d0a7000000000000000000000000000000000000000000000000000000000000",
      "reason": "owned attempt_record with verified current identity"
    },
    {
      "relative_path": "transactions/log.jsonl",
      "action": "remove_exact",
      "order_index": 6,
      "verified_identity_sha256": "d0a8000000000000000000000000000000000000000000000000000000000000",
      "reason": "owned transaction_log with verified current identity"
    },
    {
      "relative_path": ".perllsp-path-marker",
      "action": "remove_marker",
      "order_index": 7,
      "verified_identity_sha256": "d0a9000000000000000000000000000000000000000000000000000000000000",
      "reason": "owned path_marker with verified current identity"
    },
    {
      "relative_path": ".perllsp-profile-marker",
      "action": "remove_marker",
      "order_index": 8,
      "verified_identity_sha256": "d0aa000000000000000000000000000000000000000000000000000000000000",
      "reason": "owned profile_marker with verified current identity"
    },
    {
      "relative_path": "registry/perllsp-uninstall.marker",
      "action": "remove_marker",
      "order_index": 9,
      "verified_identity_sha256": "d0ab000000000000000000000000000000000000000000000000000000000000",
      "reason": "owned registry_marker with verified current identity"
    },
    {
      "relative_path": "notes.txt",
      "action": "preserve",
      "order_index": 10,
      "reason": "not installer-owned under this claim: foreign_or_user_owned"
    },
    {
      "relative_path": ".cargo-binstall/perllsp-meta.json",
      "action": "preserve",
      "order_index": 11,
      "reason": "not installer-owned under this claim: package_manager_or_other_route"
    }
  ],
  "postconditions": {
    "fresh_process_proof_required": true,
    "verify_entries_absent": [
      "candidates/v0.18.0-x86_64-unknown-linux-gnu",
      "candidates/v0.17.2-x86_64-unknown-linux-gnu",
      "current",
      "receipts/current.json",
      "receipts/previous-v0.17.2.json",
      "attempts/attempt-2026-08-20T10-00-00Z.json",
      "transactions/log.jsonl",
      ".perllsp-path-marker",
      ".perllsp-profile-marker",
      "registry/perllsp-uninstall.marker"
    ],
    "verify_preserved": [
      "notes.txt",
      ".cargo-binstall/perllsp-meta.json"
    ]
  }
}
